{
  "schemaVersion": "1.0.0",
  "candidateId": "synthetic-candidate-001",
  "reportType": "technicalDelivery",
  "status": "PASS",
  "generator": {
    "tool": "product-demo-studio-contract-fixture",
    "version": "1.0.0",
    "command": "node tests/run-contract-tests.mjs"
  },
  "inputs": [
    {
      "artifactId": "render-log",
      "sha256": "aaaaaaaaaaaaaaaaaaaaaaaaaaaaaaaaaaaaaaaaaaaaaaaaaaaaaaaaaaaaaaaa"
    },
    {
      "artifactId": "media-metadata",
      "sha256": "bbbbbbbbbbbbbbbbbbbbbbbbbbbbbbbbbbbbbbbbbbbbbbbbbbbbbbbbbbbbbbbb"
    },
    {
      "artifactId": "checksum-manifest",
      "sha256": "cccccccccccccccccccccccccccccccccccccccccccccccccccccccccccccccc"
    },
    {
      "artifactId": "render-manifest",
      "sha256": "dddddddddddddddddddddddddddddddddddddddddddddddddddddddddddddddd"
    }
  ],
  "checks": [
    {
      "id": "render-errors",
      "passed": true,
      "evidenceArtifactIds": ["render-log"]
    },
    {
      "id": "output-specifications",
      "passed": true,
      "evidenceArtifactIds": ["media-metadata"]
    },
    {
      "id": "checksums-provenance",
      "passed": true,
      "evidenceArtifactIds": ["checksum-manifest", "render-manifest"]
    }
  ],
  "summary": {
    "total": 3,
    "passed": 3,
    "failed": 0
  },
  "generatedAt": "2026-07-29T14:59:00.000Z"
}
